{"events":[],"form_id":"task199-15_29-task153-form","ledger_sha256":"sha256:98082bf1603dfdb2a71847b605c9ab4e708d3e4beb0b912663ef8dd9af6524da","ledger_status":"SOURCE_LEVEL_BLIND_ROLE_EXCLUSIONS","plan_id":"task199-15_29-task153-plan","record_type":"semantic_av_source_prescreen_exposure_ledger","schema_version":"1.0.0"}
