{"events":[],"form_id":"epic-dev-task171-P27_101-prescreener-form","ledger_sha256":"sha256:a49e7de4818ad68cd2b286751d9bd45826f63fed425fbd9f76708391ac46ee5a","ledger_status":"SOURCE_LEVEL_BLIND_ROLE_EXCLUSIONS","plan_id":"epic-dev-task171-P27_101-task153-plan","record_type":"semantic_av_source_prescreen_exposure_ledger","schema_version":"1.0.0"}
