{"events":[],"form_id":"task199-cand-052-task153-form","ledger_sha256":"sha256:455a538bc84f29c70355bdc34620cdaecb7d0c0d212ed8b0bf7919403eae9e68","ledger_status":"SOURCE_LEVEL_BLIND_ROLE_EXCLUSIONS","plan_id":"task199-cand-052-task153-plan","record_type":"semantic_av_source_prescreen_exposure_ledger","schema_version":"1.0.0"}
