{"events":[],"form_id":"epic-dev-task171-P28_103-prescreener-form","ledger_sha256":"sha256:aac278afc199d20d64ffebdbf92be54a0671b8b32eedeb51161c040b13375fa4","ledger_status":"SOURCE_LEVEL_BLIND_ROLE_EXCLUSIONS","plan_id":"epic-dev-task171-P28_103-task153-plan","record_type":"semantic_av_source_prescreen_exposure_ledger","schema_version":"1.0.0"}
