{"events":[],"form_id":"task199-16_20-task153-form","ledger_sha256":"sha256:1a47ac43f86e0c4a043e96727b23da3378cf97f61bf80b7d766c783e9642f083","ledger_status":"SOURCE_LEVEL_BLIND_ROLE_EXCLUSIONS","plan_id":"task199-16_20-task153-plan","record_type":"semantic_av_source_prescreen_exposure_ledger","schema_version":"1.0.0"}
